Greetings,"Hi, what's your full name, please?",0,0,0,1
Greetings,"Hello, could I ask for your name?",0,0,0,1
Greetings,"Hi, who is this speaking?",0,0,0,1
Greetings,"Hi, may I know your name, please?",0,0,0,1
Greetings,"Hello, could you tell me your name?",0,0,0,1
Greetings,"Good morning, what's your name?",0,0,0,1
Greetings,"Hi there, may I have your name?",0,0,0,1
Greetings,"Hello, could I get your name, please?",0,0,0,1
Greetings,"Hi, what's your name?",0,0,0,1
Greetings,"Hello, can I know your name?",0,0,0,1
Greetings,"Hi, may I know who I'm speaking with?",0,0,0,1
Greetings,"Hello, can you please tell me your name?",0,0,0,1
Greetings,"Hi, can you provide your name?",0,0,0,1
Greetings,"Good afternoon, may I know your name?",0,0,0,1
Greetings,"Hello, may I ask for your name?",0,0,0,1
Greetings,"Hi, may I know your name for the record?",0,0,0,1
Greetings,"Hello, who am I speaking with today?",0,0,0,1
Greetings,"Hi, can I have your name, please?",0,0,0,1
Greetings,"Good morning, who am I speaking to?",0,0,0,1
Greetings,"Hello, could I get your name?",0,0,0,1
Greetings,"Hi, what's your full name?",0,0,0,1
Greetings,"Hello, may I have your name?",0,0,0,1
Greetings,"Hi, can you tell me your name?",0,0,0,1
Greetings,"Hello, could you share your name?",0,0,0,1
Greetings,"Hi, may I know who you are?",0,0,0,1
Greetings,"Good afternoon, what's your name?",0,0,0,1
Greetings,"Hi, could you tell me your name, please?",0,0,0,1
Greetings,"Hello, who am I speaking with?",0,0,0,1
Greetings,"Hi, may I know your name?",0,0,0,1
Greetings,"Good evening, can I have your name?",0,0,0,1
Greetings,"Hello, could I ask for your name?",0,0,0,1
Greetings,"Hi, may I know who is calling?",0,0,0,1
Greetings,"Hi, may I know your name, please?",0,0,0,1
Greetings,"Hello, could you tell me your name?",0,0,0,1
Greetings,"Good morning, what's your name?",0,0,0,1
Greetings,"Hi there, may I have your name?",0,0,0,1
Greetings,"Hello, could I get your name, please?",0,0,0,1
Greetings,"Hi, what's your name?",0,0,0,1
Greetings,"Hello, can I know your name?",0,0,0,1
Greetings,"Hi, may I know who I'm speaking with?",0,0,0,1
Greetings,"Hello, can you please tell me your name?",0,0,0,1
Greetings,"Hi, can you provide your name?",0,0,0,1
Greetings,"Good afternoon, may I know your name?",0,0,0,1
Greetings,"Hello, may I ask for your name?",0,0,0,1
Greetings,"Hi, may I know your name for the record?",0,0,0,1
Greetings,"Hello, who am I speaking with today?",0,0,0,1
Greetings,"Hi, can I have your name, please?",0,0,0,1
Greetings,"Good morning, who am I speaking to?",0,0,0,1
Greetings,"Hello, could I get your name?",0,0,0,1
Greetings,"Hi, what's your full name?",0,0,0,1
Greetings,"Hello, may I have your name?",0,0,0,1
Greetings,"Hi, can you tell me your name?",0,0,0,1
Greetings,"Hello, could you share your name?",0,0,0,1
Greetings,"Hi, may I know who you are?",0,0,0,1
Greetings,"Good afternoon, what's your name?",0,0,0,1
Greetings,"Hi, could you tell me your name, please?",0,0,0,1
Greetings,"Hello, who am I speaking with?",0,0,0,1
Greetings,"Hi, may I know your name?",0,0,0,1
Greetings,"Good evening, can I have your name?",0,0,0,1
Greetings,"Hello, could I ask for your name?",0,0,0,1
Greetings,"Hi, may I know who is calling?",0,0,0,1
Greetings,"Thank you for reaching out! How can I help you today?",1,0,0,0
Greetings,"I really appreciate your call! What can I do for you today?",1,0,0,0
Greetings,"Thanks for calling! How may I assist you?",1,0,0,0
Greetings,"I’m so glad you called! What can I help you with?",1,0,0,0
Greetings,"Thanks for reaching out! What can I assist with today?",1,0,0,0
Greetings,"I appreciate you calling today! How can I help?",1,0,0,0
Greetings,"Thanks for calling in! How can I support you today?",1,0,0,0
Greetings,"We’re happy to hear from you! How can I assist?",1,0,0,0
Greetings,"It’s great to have you on the line! What can I do for you?",1,0,0,0
Greetings,"I’m thankful you called! How can I make your day easier?",1,0,0,0
Greetings,"Thanks for calling today! Let me know how I can assist.",1,0,0,0
Greetings,"I’m grateful for your call! How may I help you?",1,0,0,0
Greetings,"Thank you so much for calling! How can I help you today?",1,0,0,0
Greetings,"We’re so pleased you reached out! What can I help with?",1,0,0,0
Greetings,"Thanks a lot for calling! How can I be of service?",1,0,0,0
Greetings,"I’m thrilled to help you! What’s on your mind today?",1,0,0,0
Greetings,"We appreciate your call! How can I support you today?",1,0,0,0
Greetings,"Thanks for reaching out! What assistance do you need?",1,0,0,0
Greetings,"Thank you for calling! I’m here to help you with anything.",1,0,0,0
Greetings,"Thank you for your call! How can I make things easier for you?",1,0,0,0
